{
  "artifact_kind": "pooleos_native_kernel_smp_first_ap_readiness",
  "build": {
    "all_profile_binaries_distinct": true,
    "default_pooleboot": {
      "byte_count": 207360,
      "clean_build_count": 2,
      "development_transfer_feature": false,
      "exact_clean_build_match": true,
      "host_contract_test_count": 8,
      "host_contract_test_pass_count": 8,
      "host_leakage_hit_count": 0,
      "host_leakage_marker_count": 7,
      "host_toolchain": {
        "profile_id": "POOLEOS-HOST-MSVC-1",
        "profile_sha256": "4BD6B069392E11215EE1942425B3A12CE2CAEC6746A9450EAC20B037FC538182",
        "scope": "host_linker_and_library_trees_not_complete_host_attestation",
        "verified_before_build": true
      },
      "inspection": {
        "byte_count": 207360,
        "characteristics": 34,
        "debug_directory": {
          "rva": 0,
          "size": 0
        },
        "debug_directory_present": false,
        "dll_characteristics": 33120,
        "entry_nonzero": true,
        "entry_point": 36042,
        "file_alignment": 512,
        "format": "PE32+",
        "header_size": 1024,
        "image_base": 5368709120,
        "image_size": 221184,
        "import_directory": {
          "rva": 0,
          "size": 0
        },
        "imports_present": false,
        "machine": 34404,
        "section_alignment": 4096,
        "section_count": 4,
        "sections": [
          {
            "characteristics": 1610612768,
            "name": ".text",
            "raw_offset": 1024,
            "raw_size": 153088,
            "virtual_address": 4096,
            "virtual_size": 152691
          },
          {
            "characteristics": 1073741888,
            "name": ".rdata",
            "raw_offset": 154112,
            "raw_size": 51712,
            "virtual_address": 159744,
            "virtual_size": 51500
          },
          {
            "characteristics": 1073741888,
            "name": ".eh_fram",
            "raw_offset": 205824,
            "raw_size": 512,
            "virtual_address": 212992,
            "virtual_size": 64
          },
          {
            "characteristics": 1107296320,
            "name": ".reloc",
            "raw_offset": 206336,
            "raw_size": 1024,
            "virtual_address": 217088,
            "virtual_size": 740
          }
        ],
        "sha256": "0EC539F673AFF331AF7863ECF5D2A437438FF6B8172AEE168EEECEECB0CFA9FB",
        "subsystem": 10,
        "timestamp": 0
      },
      "selected_development_feature": null,
      "sha256": "0EC539F673AFF331AF7863ECF5D2A437438FF6B8172AEE168EEECEECB0CFA9FB"
    },
    "default_stop_marker_present": true,
    "default_transfer_marker_absent": true,
    "kernel_entry": {
      "artifact_kind": "pooleos_native_kernel_entry_readiness",
      "bindings": {
        "contract": {
          "byte_count": 10872,
          "path": "specs/native-kernel-entry-contract.json",
          "sha256": "21C754A8DEA3496FDC1C33CA528A091CC67C6CE3D6CE1821BF34C013DC639ABA"
        },
        "contract_schema": {
          "byte_count": 3952,
          "path": "specs/native-kernel-entry-contract.schema.json",
          "sha256": "0D9EDA08890522A9FA0E9829BAAA142BD67AC7D4F40058404EF822C829683B76"
        },
        "implementation_inputs": [
          {
            "byte_count": 601,
            "path": "native/Cargo.toml",
            "sha256": "210BCDAF2778606B42C688E7BACD950FC0EEF3045081E884CF7846B9A7D78DF4"
          },
          {
            "byte_count": 4193,
            "path": "native/Cargo.lock",
            "sha256": "29CE9938C5C60DEA5AEA244A6961BB1924D88AEC601D1E02EAAA510B0B36E390"
          },
          {
            "byte_count": 1371,
            "path": "native/kernel/Cargo.toml",
            "sha256": "F9F3AB6D84008B0354A5B82B0F616C5652C076C15F3313F14B862ED0DB1C1C43"
          },
          {
            "byte_count": 3199,
            "path": "native/kernel/README.md",
            "sha256": "804016CE88E41A3FAFF8130D6E6484AFCD2AC821625DC47CEA7EEDBD3524F41B"
          },
          {
            "byte_count": 1417,
            "path": "native/kernel/arch/x86_64/README.md",
            "sha256": "E7589BC85E7A56A67AFCFA335EB292D5262FBC37D78F4720AD4C3A76EBB205EB"
          },
          {
            "byte_count": 2048,
            "path": "native/kernel/linker.ld",
            "sha256": "01FD262DEAD5729E7EE446D2997D0BE3462C979764CAEFE66DE078EFD71FDEE3"
          },
          {
            "byte_count": 447,
            "path": "native/kernel/manifest.pkm",
            "sha256": "4AE53650627ABA7740B172C18D8F7806D6AFF6A564DA7BA547F37B496D565575"
          },
          {
            "byte_count": 65667,
            "path": "native/kernel/src/lib.rs",
            "sha256": "7EF9889DE2EE78E7DFE0499465141EEDEC0735F064B9F77C4C6DE257BA2BEAD3"
          },
          {
            "byte_count": 539008,
            "path": "native/kernel/src/main.rs",
            "sha256": "1AEE208C09FD72069CF3E16495E352EF8A88EA9BCE06BC24DDF661FEF847531D"
          },
          {
            "byte_count": 162769,
            "path": "native/kernel/src/arch/x86_64.rs",
            "sha256": "F39BB4327F83BC44AE4E38DDFA0F46793209F30D7CA3B7A0A44342FC1BBDC058"
          },
          {
            "byte_count": 50523,
            "path": "native/kernel/src/scheduler.rs",
            "sha256": "699D2EB712489E95D35729F72438906C97EF336A04112EFF910BB46074CAE21B"
          },
          {
            "byte_count": 24328,
            "path": "native/kernel/src/scheduler_preempt.rs",
            "sha256": "DD93A83C27F49D78CBFBB1A5DB026DAC2206099E226E2038595B72DC7A81D0E4"
          },
          {
            "byte_count": 33519,
            "path": "native/kernel/src/acpi.rs",
            "sha256": "E018A4DED4146791A2F88374B49CADD7356C8187807EDFBDD6FEAAA4527EB58F"
          },
          {
            "byte_count": 196651,
            "path": "native/kernel/src/physical_memory.rs",
            "sha256": "ABFEF48FEE61D4BA7AC00E067901804795FEBBBB1611878E84D5C40892587F72"
          },
          {
            "byte_count": 9602,
            "path": "native/kernel/src/physical_memory/retention.rs",
            "sha256": "CEBC587CFCD784D747C202EF4935EDCFD5A1FEE6E97F28EDCB3AD8EA6CD61EB8"
          },
          {
            "byte_count": 18891,
            "path": "native/kernel/src/physical_memory/tests/retention.rs",
            "sha256": "4489C91A41BA378B0330BFC88EB9E0F0FC4CD2E52009F93DE13CDAB812180F78"
          },
          {
            "byte_count": 12792,
            "path": "native/kernel/src/physical_memory/tests/ap_resources.rs",
            "sha256": "B3CDC5A67BC98AC4918184D01DAB57BA1FBB8A33887D45E1B741B3A37656682C"
          },
          {
            "byte_count": 11657,
            "path": "native/kernel/src/reclamation.rs",
            "sha256": "3F341CD3C830D04CBD6332E20D97928072C2CBBED56176B382E525532A93B48F"
          },
          {
            "byte_count": 6430,
            "path": "native/kernel/src/reclamation/ap_resources.rs",
            "sha256": "3EDF558319B69961D0E19D0350A440CEE34C04C82A22C3AF336982FDB6ED3CF7"
          },
          {
            "byte_count": 40366,
            "path": "native/kernel/src/virtual_memory.rs",
            "sha256": "956CB1A42A93B82B1F56637158ECF3AF7DE0ED55DF2565E3A0BCDD2DDB7E601D"
          },
          {
            "byte_count": 82907,
            "path": "native/kernel/src/active_virtual_memory.rs",
            "sha256": "A922E790E573B9D92A9882DB7498CB9017487FAB933B83B4B7BFCBEE11AA9DED"
          },
          {
            "byte_count": 63838,
            "path": "native/kmap/src/lib.rs",
            "sha256": "898996B3D2E725C257AD3270E9EA48D5E43450E5BFB6478E0E224B1BFB6B86CB"
          },
          {
            "byte_count": 218,
            "path": "native/fixtures/poolekernel/Cargo.toml",
            "sha256": "6D0DDE25F74DEEEDA7794077273B85A4A8B099E73C68939C686173716D20FF46"
          },
          {
            "byte_count": 252,
            "path": "native/fixtures/poolekernel/README.md",
            "sha256": "DE43978E1E9B8A3972DC1BD8D2DA6CC0690325664C0B170460C261E3A0713BDD"
          },
          {
            "byte_count": 349,
            "path": "native/fixtures/poolekernel/src/main.rs",
            "sha256": "C211A93BF7EDF8CCFC1E1EBBF03063825D63AC52A330A71F41CD43D27664CFD7"
          },
          {
            "byte_count": 15101,
            "path": "runtime/native_kernel_image.py",
            "sha256": "27D29DF0BBB5180AB9F8A9E8131EB4C4851C3DA0FF87A5D770DAA35BA73DE76A"
          },
          {
            "byte_count": 9892,
            "path": "runtime/native_kernel_entry.py",
            "sha256": "D6CD230A5EE6E17D9AD4270F97E08785DF7CBB4976AF99D65C2FC242C31C918A"
          },
          {
            "byte_count": 25233,
            "path": "tools/qualify_native_kernel_entry.py",
            "sha256": "8B03FFD23EC9C2F3C6F82ED98185A71668B7FE75F137E30A89184F28C7BDF36C"
          },
          {
            "byte_count": 10928,
            "path": "tests/test_native_kernel_entry.py",
            "sha256": "5E101AC0188D86E586EFFFA95247836D5C0BF85A48FE25885F40FD10C712E548"
          },
          {
            "byte_count": 4248,
            "path": "tests/test_native_smp_transactions.py",
            "sha256": "321374D12C8C113A4F6887E8255F9241FF005D0171A199419F4E2DB71667947F"
          },
          {
            "byte_count": 10676,
            "path": "tests/fixtures/pksched4_transaction_probe.rs",
            "sha256": "13C3D0934B6FE435404DABAA0D2B22F913B556AE4D0A25BD809972D435DC8F56"
          },
          {
            "byte_count": 6463,
            "path": "tests/test_native_ap_worker_transactions.py",
            "sha256": "6774DFA9A106BDABE1C348D3CE0DBCA833D54DF90D102563B47E515325CCA850"
          },
          {
            "byte_count": 13612,
            "path": "tests/fixtures/pksched5_transaction_probe.rs",